<?xml version="1.0" encoding="UTF-8"?>
<!DOCTYPE mapper SYSTEM "crawler-1-mapper.dtd" >
<mapper namespace="com.crawler.artifact.mappers.JdMapper">

	<globalheaders id="jdheaders">
		<header name="Host" value="www.jd.com" />
		<header name="User-Agent" value="Mozilla/5.0 (Macintosh; Intel Mac OS X 10.12; rv:56.0) Gecko/20100101 Firefox/56.0" />
		<header name="Accept" value="text/html,application/xhtml+xml,application/xml;q=0.9,*/*;q=0.8" />
		<header name="Accept-Encoding" value="gzip, deflate" />
		<header name="Accept-Language" value="zh-CN,zh;q=0.8,en-US;q=0.5,en;q=0.3" />
		<header name="Connection" value="keep-alive" />
		<header name="Upgrade-Insecure-Requests" value="1" />
	</globalheaders>

	<charset>utf-8</charset>

	<settings>
		<cache timeout="300" />
	</settings>

	<get id="jd_login">
		<headers refid="jdheaders" />
	</get>

</mapper>