<?xml version="1.0" encoding="UTF-8"?>
<!DOCTYPE mapper SYSTEM "crawler-1-mapper.dtd" >
<mapper namespace="com.crawler.artifact.mappers.TbMapper">

	<globalheaders id="tbheaders">
		<header name="Host" value="www.jd.com" />
		<header name="User-Agent" value="Mozilla/5.0 (Macintosh; Intel Mac OS X 10.12; rv:56.0) Gecko/20100101 Firefox/56.0" />
		<header name="Accept" value="text/html,application/xhtml+xml,application/xml;q=0.9,*/*;q=0.8" />
		<header name="Accept-Encoding" value="gzip, deflate" />
		<header name="Accept-Language" value="zh-CN,zh;q=0.8,en-US;q=0.5,en;q=0.3" />
		<header name="Connection" value="keep-alive" />
		<header name="Upgrade-Insecure-Requests" value="1" />
	</globalheaders>

	<charset>utf-8</charset>

	<settings>
		<cache timeout="300" />
	</settings>

	<get id="login">
		<url value="https://www.taobao.com/" />
		<headers refid="tbheaders" />
		<retry>
			<times value="3" />
			<means>
				<mean type="code" value="200" />
				<mean type="content" value="NamePlace" />
				<mean type="cookie" value="CoreSessionId" />
			</means>
		</retry>
		<properties resume="true">
			<property name="connectionTimeout" value="20000" />
			<property name="socketTimeout" value="20000" />
		</properties>
	</get>

</mapper>